_id,playerId,gameId,createdAt,data.age,data.gender,data.language,data.raceWhite,data.raceBlack,data.raceAsian,data.raceNative,data.raceIslander,data.raceHispanic,data.education,data.correctness,data.human,data.workedWell,data.fair,data.chatUseful,data.feedback,data.time
DPcr5HEgCr5CkgPdF,nmHXPxyCH8CWM2jP9,emW2xYKfguGYpC6sY,2022-04-04T22:01:28Z,47,male,English,,true,,,,,bachelor,yes,yes,stronglyAgree,yes,yes,no,yes
H6JgySfSZpZmTxG6E,ze8AHQrgFuaxgC3KS,emW2xYKfguGYpC6sY,2022-04-04T22:01:40Z,66,female,English,true,,,,,,highSchool,yes,yes,agree,yes,yes,no,yes
tNkX8svbAFAzNmwz5,DF9yFtKHN6i93p3nY,emW2xYKfguGYpC6sY,2022-04-04T22:01:49Z,29,male,english,,,true,,,,master,yes,yes,agree,yes,yes,no,yes
2ATPZfMydyCCt7rkm,YubyupikCMLLvWk3k,oXTMu3q59e3nffGz3,2022-04-04T22:01:52Z,25,Male,English,,,true,,,,master,yes,yes,stronglyAgree,Yes,Yes,No,Yes
FG9rCBypnCzddZXAp,9SLZJ9XxkEHuEKx2Q,emW2xYKfguGYpC6sY,2022-04-04T22:02:01Z,29,Female,English,,,true,,,,master,yes,yes,agree,no. it took a lot of time and also could not play the full game just because one participant left,yes,no,yes
gBrPH7TwreTB946gJ,zQ7AHb9SZbi5hCYoT,emW2xYKfguGYpC6sY,2022-04-04T22:02:05Z,28,female,english,,true,,,,,bachelor,yes,yes,stronglyAgree,yes,yes,"yes, a partner disconnected ",no
6bS2No8djWMQso4mD,oHLpenGYnu22To7CJ,oXTMu3q59e3nffGz3,2022-04-04T22:02:16Z,41,Male,English,true,,,true,,,someCollege,yes,yes,stronglyAgree,All went well,Very easy to use,No all went well,Yes
RTjg4KwaPRK7kQ3ha,wXpDHE9b42npPyMa4,oXTMu3q59e3nffGz3,2022-04-04T22:02:20Z,52,Male,English,true,,,,,,someCollege,yes,yes,stronglyAgree,yes,Yes,No problems,Yes
TpKKspGbAqZj9sT5t,TTsmeMeJ8oi35hh2E,oXTMu3q59e3nffGz3,2022-04-04T22:02:22Z,32,female,English,true,,,,,,bachelor,yes,yes,stronglyAgree,yes,yes it was simple and easy to use,none,yes there was enough time
gt6naru6NwYggnNHw,eWYZbqHQGWcu5nGrq,emW2xYKfguGYpC6sY,2022-04-04T22:02:54Z,34,Non-binary,English,true,,,,,,bachelor,yes,yes,agree,"Lol, you probably would have had to up it to make Prolific's pay per hour if we'd done all six rounds",yes,no,yes
n35askCAKpKocwcgv,LTS4YALfJnHNGsMfu,oXTMu3q59e3nffGz3,2022-04-04T22:02:59Z,57,male,english,true,,,,,,bachelor,yes,yes,stronglyAgree,Yeah - about right,No problems - bar my typing skills,no,Did tell them to hold off clicking on an easy one to buy some time for a bit more explanation
NG2iEJN4rspJvwXN2,wxCwZoiym9EZwW5nv,oXTMu3q59e3nffGz3,2022-04-04T22:03:01Z,37,Female,English,true,,,,,,master,yes,yes,stronglyAgree,yes,very easy ,no problems,Plenty of time especially as we stated to know the images quickly
3r5xbSmhX3AfBBjyB,YiDzuDyZdYqfo7p9D,,2022-04-04T22:04:05Z,30,Male,English,true,,,,,,bachelor,yes,yes,neutral,I believe so.,I can't assess it as I didn't get to use due to there not being enough participants to start the game.,The only problem is finding the participants to play the game with.,I am not sure as I didn't get to play the game.
9gWLFP3WfmbBi9aQD,imktxRWGmLZggEPpw,93veKnFJ5opKn4uDg,2022-04-04T22:07:15Z,53,male,english,true,,,,,,someCollege,yes,yes,stronglyAgree,very,very easy and amusing,it took time for the other participants to realise how long they were taking and could speed it up,yes
FZxwjeaTkongvwkY7,qkYQEy4pcfQq2JQNM,93veKnFJ5opKn4uDg,2022-04-04T22:07:19Z,49,Female,English,true,,,,,,master,yes,yes,stronglyAgree,It took a little longer than expected so it fell a little short in pay,Yes,No problems,Plenty!
acWxFL6g6FdJAkb9i,ber2cyTGrn8AypTDi,93veKnFJ5opKn4uDg,2022-04-04T22:07:19Z,33,female,english,,true,,,,,bachelor,yes,yes,stronglyAgree,yes,very!,"no. it was a fantastic guessing game, i felt very involved with my team ",very more than enough time
GMMn4qGBD96FndpQR,kC4dakn5W4f8N58mm,93veKnFJ5opKn4uDg,2022-04-04T22:07:50Z,21,female,English,,true,,,,,highSchool,yes,yes,stronglyAgree,Yes ,"yes it was, I loved it",No ,Yes more than enough
LP8xTJ9CHnfB8yTAH,tRX6qFQMvrPQ6cJRY,93veKnFJ5opKn4uDg,2022-04-04T22:07:54Z,64,Male,English,true,,,,,,master,yes,yes,stronglyAgree,"The scale was fair, but it seemed to take longer than we'd anticipated.","fairly easy. It was annoying to have to click on the box each round to start it recording what I typed\n",Where did the participants' names come from?,Yes 
EKvPDkNAkkhX7myLW,s3dxg4tXM5Rv9CC3h,93veKnFJ5opKn4uDg,2022-04-04T22:08:28Z,46,Male,English,true,,,,,,highSchool,yes,yes,stronglyAgree,"It took longer than expected, but was quite entertaining and had bonuses","Yes, but sometimes I thought I was typing but nothing was being entered",no,"yes, though it was tight on some of the early rounds - it got easier as the rounds progressed"
4RXvsES6dwmt2srJ5,62hdtatPoTPryWMMY,acL8Dhxe4PDAn42od,2022-04-04T22:10:39Z,37,male,english,true,,,,,,bachelor,yes,yes,stronglyAgree,yes,yes,no but it was fun!,yes
MKiGtexyXcN9tiZRk,dsSQPa7CdRfAk5fn8,acL8Dhxe4PDAn42od,2022-04-04T22:10:43Z,64,female,english,true,,,,,,bachelor,yes,no,agree,"I believe the study went over 70 minutes, didn't it?",very easy,no,yes
wHF9C8vomPb5yCe4t,jtbZ4XfDnEkv55ut4,acL8Dhxe4PDAn42od,2022-04-04T22:10:54Z,29,male,english,true,,,,,,master,yes,yes,stronglyAgree,"Maybe, not entirely sure ",Yes definetly was good ,"nope, thanks",yeah fine
c8zNeTvch5szganD9,k7XADXDMS42anGm3m,acL8Dhxe4PDAn42od,2022-04-04T22:10:55Z,27,Male,English,,,true,,,,master,yes,yes,agree,I think base pay could be higher but otherwise pay was fair.,"Yes, I felt the in-game chat feature was easy to use.",No problems or comments.,"I feel like we had sufficient time in all rounds, perhaps too much time in the later rounds."
Qsmj4BFK3vkM3YsW9,FXYXhnXqQw4DFh5eo,acL8Dhxe4PDAn42od,2022-04-04T22:11:09Z,28,Male,English,true,,,,,,highSchool,yes,yes,stronglyAgree,Seems to be.,"Yeah, no issues",,"Yeah, once you get it down it's more than enough."
j77GBRwgYqQ88RN32,JfQgoDnAWtErQsWxz,acL8Dhxe4PDAn42od,2022-04-04T22:11:41Z,39,female,english,,true,,,,,bachelor,yes,yes,agree,Not really. Too long for the pay,Yes,no,yes
awMFJSAnS2qB3g8n3,ASHgKQwSFNZHvxMq7,qvcePeQSJ7k2HTcJt,2022-04-04T22:17:24Z,32,female,english,true,,,,,,bachelor,yes,no,stronglyAgree,did take longer than expected,yes,no,too much
mnWcTuEBu82oxJzAw,yhGXQ4dtFhEMQEsK5,qvcePeQSJ7k2HTcJt,2022-04-04T22:17:24Z,023,Female ,English,true,,,,,,master,yes,yes,stronglyAgree,"Yes, as the speaker deserves more as they put more work in ",Yes ,No,Yes plenty of time 
KpBpqrntGRmByE7aR,z6Qy3aEScCTeSH9ox,qvcePeQSJ7k2HTcJt,2022-04-04T22:17:29Z,42,male,english,true,,,,,,someCollege,yes,yes,stronglyAgree,yes,yes,no,yes
LMSorwPCr6Dn6TXZM,urKgEJbrQQNHGiNrd,qvcePeQSJ7k2HTcJt,2022-04-04T22:17:53Z,20,Female,English,,,true,,,,someCollege,yes,yes,stronglyAgree,"Yes kind of, however the study was long and could have been compensated more for the time ",yes,no,yes
X23ufdYPGxndKn8Sk,cJc2Q44cqbBLx8Xd6,qvcePeQSJ7k2HTcJt,2022-04-04T22:18:14Z,21,female,english,,true,,,,,bachelor,yes,yes,stronglyAgree,yes,yes,no,yes more than enough
beuKP5NpPnRovbbEm,arByDDp6uQRRyQPdZ,qvcePeQSJ7k2HTcJt,2022-04-04T22:18:22Z,37,Male,English,true,,,,,,bachelor,yes,yes,stronglyAgree,I think so but I am always happy to earn more. ,It was I really loved this it was so much fun. ,none,plenty of time but still felt the pressure to get to work. 
w7RkW6cQ8dF3yC3NG,Gp6brrd7obJTAq5ar,MyRbvfzsvHgTGSNRY,2022-04-04T22:21:15Z,38,m,english,true,,,,,,bachelor,yes,yes,agree,yes i do,it worked easily,no,yes i do
AfSCm9c9CtxvkB5aF,RTkHM8qMHxnEMz2BZ,MyRbvfzsvHgTGSNRY,2022-04-04T22:21:57Z,40,Female,English,true,,,,,,someCollege,yes,yes,stronglyAgree,It took alot longer than anticipated so i think it could have been slightly higher,Yes,"No, not at all",Yes
hc8G5YmmpihHL45mQ,XaZJLnAoSC7dLqJwd,MyRbvfzsvHgTGSNRY,2022-04-04T22:22:08Z,48,female,English,true,,,,,,master,yes,yes,neutral,yes,yes,no comments,yes
yT8bav6jy3gWQRYeg,kmwgvC28whEN6kQ8T,MyRbvfzsvHgTGSNRY,2022-04-04T22:22:31Z,47,male,english,true,,,,,,bachelor,yes,no,agree,i feel this is underpaying,yes,no all good,yes
9ZW7YwCGs27oQGYNG,3jsYYwLiMPTfjohSG,MyRbvfzsvHgTGSNRY,2022-04-04T22:22:48Z,57,Male,English,true,,,,,,someCollege,yes,yes,agree,Maybe fair if it includes the bonus,"Yes, no problems","No, none.",Perhaps too much. 2 minutes or 2.5 would have worked fine.
RcoWo9MKCzefhDJXF,GqKpYNiW2MfTGTTbN,MyRbvfzsvHgTGSNRY,2022-04-04T22:25:16Z,43,male,English,true,,,,,,someCollege,yes,yes,agree,"The pay is fair, as long as I'm paid as I should be. This ended prematurely on the very final round, so it kind of felt like I was getting hosed. I feel like I earned my bonuses.","Yes, there were no problems.","I was disappointed that this ended prematurely with a message that one of the other participants had disconnected. Aside from that, I kind of enjoyed the task.","Yes, I felt like there was plenty of time."
MGdm58mNL8uJRTrz6,ZA2Xp2uH8MwnfGknA,uBEeQNkPmETCWMFi8,2022-04-04T22:38:22Z,26,female,english,true,,,,,,highSchool,yes,yes,stronglyAgree,yes,very easy,nope,yes more than enough
oqrH8aoBxWtDeiTHG,eHgnYSqXkkkmbg6Bj,uBEeQNkPmETCWMFi8,2022-04-04T22:38:31Z,34,Male,English (U.K.),true,,,,,,someCollege,yes,yes,agree,Perhaps,Yes,No,Yes
tutX5ne8tiEMLpy5A,CfyfwSQwLa6nN5D6y,uBEeQNkPmETCWMFi8,2022-04-04T22:38:51Z,64,FEMALE,ENGLISH,true,,,,,,highSchool,yes,yes,stronglyAgree,YES,VERY EASY,NO.  IT WAS VERY ENJOYABLE.  THANK YOU :-),YES
WeMmeSfdfJsaK4GLs,hQjMxKbswJv5jZSoe,uBEeQNkPmETCWMFi8,2022-04-04T22:38:59Z,57,Female,English,true,,,,,,master,yes,yes,stronglyAgree,"No - The study took 2 hours 5 mins to do, when it indicated it would take 70 mins",very,"Just too long, but an excellent study as we gradually all realised about speeding up ",Plenty
tFANNeMGjYtKypvyu,nvGtQ5sNc5N23Jxra,uBEeQNkPmETCWMFi8,2022-04-04T22:39:49Z,52,Female,English,true,,,,,,someCollege,yes,yes,agree,Took a lot longer than 70 minutes!,Yes,No,Yes
ddvXExnddTwCdj2BK,y3boqLqAxGBPGi9n3,uBEeQNkPmETCWMFi8,2022-04-04T22:39:56Z,31,female,English,,true,,,,,bachelor,yes,yes,stronglyAgree,No because it is really time consuming and the pay does not compensate the time time spent on the study,"yes, very easy",No,Yes
