_id,playerId,gameId,createdAt,data.age,data.gender,data.language,data.raceWhite,data.raceBlack,data.raceAsian,data.raceNative,data.raceIslander,data.raceHispanic,data.education,data.correctness,data.human,data.workedWell,data.fair,data.chatUseful,data.feedback,data.time
X464zxMkstFw63oyW,5TRGDDvFoSqdFxy6z,,2022-03-31T19:02:22Z,26,male,English,true,,,,,,bachelor,yes,,,,,,
k3fgDseagkWnDDGAS,5WJuxLfe5niSaBPCs,,2022-03-31T19:02:47Z,19,Female,English,,,true,,,,someCollege,yes,no,stronglyDisagree,,,,
qFS4QzhFF2Ka8z8e6,zG8KbzT93cabrhpQX,,2022-03-31T19:02:48Z,24,female,english,,true,,,,,bachelor,,,,,,,
QMwybTQr4ncpiTsao,BZ33Z3ckuTZqkvWLp,,2022-03-31T19:02:53Z,29,Female,English,true,,,,,,someCollege,yes,yes,neutral,yes,n/a,n/a,n/a
qxQBBWsRbSq6uQiTJ,pGRgN7WFuz6Kye7gw,,2022-03-31T19:03:20Z,32,F,English,,true,,,,,someCollege,yes,no,stronglyDisagree,I did not play,No,No,No
YS9ZBT94chZTQwjaz,bZN5e6x6KQmBGcLPS,,2022-03-31T19:03:30Z,33,female,english,,true,,,,,bachelor,yes,yes,stronglyAgree,No idea,No idea,No idea,No idea
HdgvCG2nrkTgjqQ26,eQEGsPdG5J5N7ShbR,,2022-03-31T19:03:39Z,59,male,English,true,,,,,,highSchool,yes,no,neutral,I am not sure what the pay is,n/a,My group had 5/6 members then the task was curtailed due to low interest,n/a
nHyzJEBnuEpD8mBro,wY4Ss8z9GxTar8DXx,,2022-03-31T19:04:36Z,34,female,english,true,,,,,,bachelor,yes,yes,neutral,yes,"I was unable to use the chat feature as only 5/6 participants made it to the Lobby, but from the instructions it looked very easy to use.",Just disappointed I did not get to participate properly as I was looking forward to doing it,n/a
RkseGve7pLSr9oHZ3,TKkheuqivmSM2HBSg,,2022-03-31T19:05:37Z,31,Male,English,true,true,,true,false,,bachelor,yes,yes,neutral,yes,game never started. Please invite me to play again.,no. Please invite me to play again.,Game never started. Please invite me to play again.
hnsAL25q93mGh47N9,CKmbr6eMnv33bKWMQ,,2022-03-31T19:17:57Z,26,male,English,true,,,,,,bachelor,yes,,,,,,
AL9Cc3jAxNRJC2LN5,QCvF7iz9EZHKGgPFA,,2022-03-31T19:30:43Z,30,Male,Arabic,true,,,,,,bachelor,yes,yes,neutral,"The pay is just fair if there was enough people, but a little more would be great! Contact me if you want my participation again. I will gladly do it since I am getting paid for almost nothing.","I don't know, sadly I didn't get to try it.","I am not sure why there were no participates, but that's really unfortunate.",N/A
qR9PYnvdZEYbpLKDX,SNKZcpXznSxMQbtXL,zviCQXNM4xWoYTmoY,2022-03-31T19:32:09Z,21,Female,English,,,true,,,,master,yes,yes,stronglyAgree,Yes,Yes,No,Yes
AFfv4bYMnX2wbLNq4,XBjhcfLtesgASpEW2,zviCQXNM4xWoYTmoY,2022-03-31T19:32:15Z,28,Female,English,true,,,,,,bachelor,yes,yes,stronglyAgree,Yes.,Definitely. ,N/A,More than.
GeQPSwi7bD6Q4kQjf,8qpTxRSMtKdunwcqh,zviCQXNM4xWoYTmoY,2022-03-31T19:32:26Z,31,Female,English,true,,,,,,bachelor,yes,yes,stronglyAgree,"Yes, very fair",Yup!,No,Definitely
aZLhXFWH3imwsPLmH,xzEFcLxSaz7ZmqRw6,zviCQXNM4xWoYTmoY,2022-03-31T19:32:26Z,42,Female,English,true,,,,,,bachelor,yes,yes,stronglyAgree,Yes,Very easy,"no problems at all, it was actually quite fun",More than enough
ndhem9TkoaviyMvQX,5J7qybS6Kinu3Cgrf,zviCQXNM4xWoYTmoY,2022-03-31T19:33:21Z,39,Male,English,true,,,,,,bachelor,yes,yes,stronglyAgree,"The pay was fair, given the speaker had the hardest job",Very easy to use and chat with the speaker and other listeners,"No problems, great team, with a good spirit and thought the speaker described everything amazingly well.","Plenty of time, particularly as the rounds progress and you start to name the pictures. It becomes much quicker and easier."
RtaLsdMxM32bsCchC,Q5Bs5Daz3vBi66sSW,zviCQXNM4xWoYTmoY,2022-03-31T19:33:27Z,26,Non-binary,English,true,,,,,,bachelor,yes,yes,stronglyAgree,Yes,Yes,"Sometimes it would say a small number of listeners had selected correctly, but all of the little pictures assigned to the players were displaying on the correct tangram, so I thought it should say 5/5 on those occasions? Sometimes it did say 5/5 but looked the same as when it said 3/5 or whatever",Yes
JHcvWgnvx95YFC2Sd,dscYmyM8wN5o3feju,mFydM2BjifgM589Kq,2022-03-31T20:12:49Z,38,Female,English,true,,,,,,bachelor,yes,yes,stronglyAgree,Yes,Yes,No,Yes
F5jnfSHM295PvHiHN,zY3h7BkB5TkBGcwM4,mFydM2BjifgM589Kq,2022-03-31T20:12:57Z,43,Male,,true,,,,,,highSchool,yes,yes,stronglyAgree,Maybe it was a lot of work though,Yes,No,Yes too much to be honest
9PupTGmaDFMRrftdJ,RCtT8PJsDnFWBE44N,mFydM2BjifgM589Kq,2022-03-31T20:13:01Z,53,Female,English,true,,,,,,bachelor,yes,yes,stronglyAgree,It's ok,yes,It was brilliant observing how we started off clueless and then we excelled together.,yes
s8fqYh7DNqjuhZS8d,Dtqy4LrocKduvjQAJ,mFydM2BjifgM589Kq,2022-03-31T20:13:27Z,57,Female,English,true,,,,,,someCollege,yes,yes,agree,yes it was fair,yes easy to use,no,yes had enough time although was quite stressful at the beginning
kZNTwkHc2cdxeXjDm,fxPohWWFgMPKLfCje,mFydM2BjifgM589Kq,2022-03-31T20:13:44Z,66,Male,English,true,,,,,,someCollege,yes,yes,neutral,Yes,Yes,"I couldn't change my mind, I was stuck with my first choice, even if the speaker retracted a clue.",Yes
dfcTdZXvAbhWQ9cc8,xgiHduQDPM8Em4NYq,mFydM2BjifgM589Kq,2022-03-31T20:14:16Z,49,F,English,true,,,,,,someCollege,yes,yes,neutral,"Yes, it was people taking way too long that made it longer",Yes,"Yes, on one of the rounds I couldn't select a figure as it was still stuck on the last one I chose from round before so we had to let the timer run down",More than enough
3CYqCw8ArnnLtoRMw,FrgvTQMyYw2PtB4FM,uvTWfZnixQs6nHoYg,2022-03-31T20:16:41Z,35,Male,English,true,,,,,,master,yes,no,agree,Yes,Yes,No,Yes
TLZMNmHQh8zsvu8in,Yt4E9ypgJohLYb5Fi,uvTWfZnixQs6nHoYg,2022-03-31T20:17:04Z,23,Female,English,true,,,,,,bachelor,yes,yes,agree,yeah it was just a lot longer than expected,yes,all good,more than
v2sLQtZTeA8cfyTBF,9wh7emuJZwNAA8x2Y,uvTWfZnixQs6nHoYg,2022-03-31T20:17:07Z,33,Male,English,true,,,,,,bachelor,yes,yes,stronglyAgree,I thought you were fair but I think you underestimated the time it took. Please add a couple dollars bonus because it went over the estimate,Yup.,"Nope, everything went smoothly",Yes.
MnSeKg2woGquaB2gW,26CcB9PbDmhM35ZNP,uvTWfZnixQs6nHoYg,2022-03-31T20:17:12Z,31,female,english,true,,,,,,lessHighSchool,yes,yes,stronglyAgree,Yes,Very easy worked great,No problems,yes 
KCtTyX8EHRaWqDfnx,A3WjK6mYe9hWymanm,uvTWfZnixQs6nHoYg,2022-03-31T20:18:24Z,25,Female,English,true,,,,,,bachelor,yes,yes,stronglyAgree,Yes I did - It was fair and felt equal and everyone did their part.,"Very, was quick to type and receive responses.","No everything ran fine no issues, thank you.","Yes defo - had more than enough time, didn't feel too rushed or anything."
te3thiZshkSTNYuzp,9dRXS3rNnk4nrKRep,uvTWfZnixQs6nHoYg,2022-03-31T20:19:36Z,32,Male,English,true,,,,,,bachelor,yes,yes,stronglyAgree,The bonus became big enough by the end,I would have benefited from seeing my name in addition to 'you' in the chat. I didn't recognise people speaking to me for a while.,Changing selection perhaps should be allowed.,
tReBniaFxnC6aStW5,gsSzjujsquAXh3Afi,YmQjwdkn3uFBP4PK5,2022-04-04T20:36:03Z,40,Male,English,true,,,,,,someCollege,yes,yes,neutral,Yes as a base pay,I don't know - someone dropped out before I got chance to use it,I don't know - someone dropped out before I got chance to play,I don't know - someone dropped out before I got chance to use play
RKaptGQJ9XZLkseHZ,zhBEE6z97K3JCCsjt,YmQjwdkn3uFBP4PK5,2022-04-04T20:36:15Z,38,male,English,true,,,,,,highSchool,yes,yes,neutral,Yes.,I didn't get to use it.,Someone disconnected almost immediately.,Didn't even get through the first round.
Jd4vwZhDcyWyx5yxi,7XwgGu6r5rprsp99L,YmQjwdkn3uFBP4PK5,2022-04-04T20:36:18Z,21,female,english,true,,,,,,someCollege,yes,no,stronglyDisagree,yes but it sucked that i wont get paid like anything because someone disconnected before the game even started,n/a,someone disconnected before it started,n/a
WyjLJWcGFdYxSc4YY,CHc8xTit3HYJ85pof,YmQjwdkn3uFBP4PK5,2022-04-04T20:36:32Z,33,Male,English,true,,,,,,bachelor,yes,yes,stronglyDisagree,Yes ,Someone quit before I even finished typing the first message,Please re-invite me if you are doing this again as I would like to participate properly (without someone immediately quitting),n/a
4xGCnwgGXtQwYpXyY,BuaYBncGdqeo7ZBvp,YmQjwdkn3uFBP4PK5,2022-04-04T20:36:35Z,26,Female,English,true,,,,,true,someCollege,yes,yes,neutral,I think so. I didn't get to actually participate in the game because one of my team members opted out. So I am not sure how much I will be compensated. ,I didn't use it.,I didn't exactly get to play because someone from my team left. ,I didn't experience a whole round
o8QCkyi2G2tjDj8Ex,oAGtHMcsr4GGY3pwB,YmQjwdkn3uFBP4PK5,2022-04-04T20:36:36Z,33,female,english,true,,,,,,highSchool,yes,yes,neutral,yes,"I didn't get chance to use it, a participant exited before the game started so it was automatically finished",the game finished too soon if 1 person left. I was looking forward to playing,n/a
wLetASeA7ubvkuoDy,Jj9ChK6Z77gy7o5vk,,2022-04-04T20:45:21Z,36,Female,English,true,,,,,,master,yes,no,stronglyAgree,Yes,"I don't know, I got sent straight to this questionnaire",I'm disappointed I didn't get to take part - it looked fun!,"I don't know, I got sent straight to this questionnaire"
CbiZf3MEsmJeSEmuM,wsCFciY5hdArX76WF,,2022-04-04T20:49:10Z,44,Female,English,true,,,,,,highSchool,yes,yes,,,,,
KykRxQDBSEaEdkM3t,yoDC3cy8FgjEtJgzb,wsM8tvwgs3zAMw2zq,2022-04-04T20:50:09Z,25,woman,English,true,,,,,,bachelor,yes,yes,neutral,Yes.,Yes.,No.,"Too much, actually."
GnTNvqBgoPT7FoWNS,qGnixN9brEgnSbaXn,wsM8tvwgs3zAMw2zq,2022-04-04T20:50:36Z,27,male,english,true,,true,,,,bachelor,yes,yes,neutral,Yes,"Yes, it seems simple and easy to use",No,"Yes, for the most part"
kGiwPJWBxtjunJDSi,bcaAk8gsnDxphaJvh,wsM8tvwgs3zAMw2zq,2022-04-04T20:51:00Z,35,female,English,true,,,,,,someCollege,yes,yes,disagree,yes,yes,a player disconnected early so game finished early,yes
BCDQ6y4zxtyhcZ9CK,rzXauTczaGLjKnx7D,wsM8tvwgs3zAMw2zq,2022-04-04T20:51:30Z,40,Female,English,true,,,,,,someCollege,yes,yes,agree,"Yes, the pay was fair.",I haven't used it but it looked easy enough to use.,Someone disconnected during the task and the experiment finished much earlier than anticipated.,Yes.
YXwa8SCmCFAbEMBuP,C45tr5mBwvnj5M85x,wsM8tvwgs3zAMw2zq,2022-04-04T20:53:29Z,36,Male,English,true,,,,,,bachelor,yes,yes,neutral,Yes. Great pay if we get the base rate!,Yes.,Glad we timed out. Can get a shower before tea is ready now!,Yes.
7qFqNK6ezqmJndQZr,rYkWA8J7xxMZ5eTnC,AhoLfcopLZfAA6m2t,2022-04-04T20:59:32Z,53,f,english,true,,,,,,bachelor,yes,no,neutral,no,yes,"no - other than the ""speaker"" was a moron or a computer ",yes
uGtSiauS5GYPpr7mK,ShSqJbCyrwxnEmfm8,AhoLfcopLZfAA6m2t,2022-04-04T20:59:40Z,53,male,english,true,,,,,,bachelor,yes,yes,agree,"yes, but I was disappointed not to finish the game.",yes,no,yes
NMGAX2fsr4Af8YDKh,qkgQuw97t5Kekd2ae,AhoLfcopLZfAA6m2t,2022-04-04T20:59:59Z,47,male,english,true,,,,,,bachelor,yes,yes,stronglyDisagree,seemed fine if the game can be completed,yes,no,not with Hera leading the conversation
NB2kxtw3KQf5y6ZRE,K57QK5idufp4KSrGw,AhoLfcopLZfAA6m2t,2022-04-04T21:00:38Z,31,Female,Hungarian/English,true,,,,,,master,yes,no,neutral,"Yes, I guess. Speaker had bigger responsibility though.",Yes.,"No problem, It was cut short in the middle. :( It was exciting until","Not really, but we were disorganized."
kNFLAWZyFG9wvkaGS,MPRFwofZaCYbpLaij,AhoLfcopLZfAA6m2t,2022-04-04T21:03:44Z,49,female,English,true,,,,,,master,yes,yes,disagree,I was disappointed we were tossed when someone disconnected.  It was a challenge.  ,"Yes, no problem",I have a Ph.D.  Why does your education only go to master's level.  ,"Our speaker was not good, but had she been, yes, we'd have been fine.  "
ah5mFXJeGQAoMX8eG,ohxQes65QyHePPSrr,,2022-04-04T21:06:08Z,27,Non-binary,English,true,,,,,,someCollege,yes,yes,neutral,N/A,N/A,N/A,N/A
mSxk3W2NHpjsroKHR,eGsy3QuvsvYTWRH5J,,2022-04-04T21:06:40Z,68,male,English,true,,,,,,someCollege,no,yes,neutral,yes,yes,none,yes
xoxJ7LBNzBaDaptHF,YnC9uncWH5p8Grsa2,,2022-04-04T21:06:47Z,33,male,English,true,,,,,true,bachelor,yes,no,neutral,Not enough players to play the game,Not enough players to play the game,"Yes, there wasn't enough players to launch the game.",Not enough players to play I didn't get a chance to play
CEEm2DoR9RjjoTftM,W4ZFcmEDeSnYPAyDe,,2022-04-04T21:07:18Z,60,Female,English,true,,,,,,bachelor,yes,yes,neutral,Game had to be cancelled for lack of participants.,N/a,"I did not get to participate and it looked like fun. Oh well, maybe next time.",N/a
njHBQq4Eu5kHXbzHx,RdnZcBaQ5f842qfsw,,2022-04-04T21:07:19Z,50,female,English,,,true,,,,bachelor,yes,yes,neutral,not enough players to complete game,not enough players to complete game,not enough players to complete game,not enough players to complete game
SQcXK3h3NzDQa8HbY,6pMbkp4YeXJS7CCNm,wsM8tvwgs3zAMw2zq,2022-04-04T21:07:20Z,41,Male,English,true,,,,,,highSchool,yes,yes,agree,Yes.,Yes.,No.,Yes.
jeHcy72ri34gJg3Rt,GGo4CYxWJdgLNJXX2,,2022-04-04T21:08:16Z,32,Male,English,true,,,,,,bachelor,yes,yes,neutral,"I do. However, I wish the experiment had started (we lacked enough participants).","I honestly don't know, as I sat in the waiting room for several minutes before the experiment was canceled. ","Other than the study lacking participants, I did not have any problems. ",I do (at least as far as the quiz was concerned).
Yap2JsNFD7ur3ipd8,j7ghgGntCsr7m9JiD,AhoLfcopLZfAA6m2t,2022-04-04T21:08:19Z,26,Male,English,true,,,,,,bachelor,yes,yes,stronglyAgree,yes the pay is fair,it was very easy to use,"i didn't notice any problems, but i feel like the whole study shouldn't end just because a participant disconnected, i feel like the other participant should be able to continue","not really, i feel like more time should have been allocated to enable accurate description"
KmFX9JajKY52XN574,CqmuT8HABP7hRw3Wq,,2022-04-04T21:14:41Z,41,male,english,,,true,,,,master,yes,,,,,"It took a long time to open in Chrome after I had to switch from Firefox, then I had to read the instructions. Maybe you could allow a longer wait time to make sure the game will get enough players before aborting. ",
NpgtYL4yxEuntKvBZ,KHPRPsqcpxsHv2Std,stMAcJkdy6jurPNmd,2022-04-04T21:17:08Z,20,Female,English,true,,,,,,someCollege,yes,yes,stronglyAgree,it was okay,yes,no,yes
zjSqw5ckJYRooMvfe,RsfNroEpqu6N7Mwzf,stMAcJkdy6jurPNmd,2022-04-04T21:17:10Z,37,Female,Scottish,true,,,,,,bachelor,yes,yes,stronglyAgree,Yes. ,Very easy. ,"No, someone quit early",Yes
Jv2ks3quppa23S5iJ,Bff9J3zv4kAQZkbeA,stMAcJkdy6jurPNmd,2022-04-04T21:17:14Z,,,,,,,,,,,,,,"Yes, I felt the play was fair. ","Yeah, in game chat was easy to use and intuitive. ",None.,Yes.
xQrW3oMREdJhomgwZ,LrPfpyfzgfW5CFvLS,stMAcJkdy6jurPNmd,2022-04-04T21:17:25Z,22,Male,English,true,,,,,,master,yes,yes,stronglyAgree,very fair,very easy,"no, i'm just sorry it finished early","yes easily enough time, our speaker was great"
jSvLCWSMG5J8DsQsf,8MTTfRn9uPvJSxTGp,stMAcJkdy6jurPNmd,2022-04-04T21:18:33Z,28,Female,English,true,,,,,,bachelor,yes,yes,stronglyAgree,"The study looked like it would take longer to finish than one hour, which would make the hourly rate lower than stated. ",Yes very easy,It was a shame I could not finish it due to the disconnection issue. ,Felt a bit rushed in the beginning before finding our feet. 
WTWx7PaE8GCagSwfs,LJNFiZT4Gyyi7Cxhq,stMAcJkdy6jurPNmd,2022-04-04T21:18:46Z,28,male,english,true,,,,,,someCollege,yes,yes,stronglyAgree,The pay seemed fair but I would have like to do all the rounds,Yes it was very easy,Apart from it taking a while to load on that last bit before someone disconnected it was working fine,"More than enough time, we were getting into a good rythm"
EukqtmNZ6guW9myu9,LumBRLm9x9RQRNoEL,yHD3J9Xxvxban4YCS,2022-04-04T21:37:02Z,33,Female,English,true,,,,,,bachelor,yes,yes,agree,A little low,Yes,No,Yes
yK8DeDTa4veyzwzy3,qWB5sC8LNcD7AHLsY,yHD3J9Xxvxban4YCS,2022-04-04T21:37:13Z,26,female,english,true,,,,,,bachelor,yes,no,agree,yes,yes,no,yes
MgWXccCuCi9Zq9SYA,NK2iZeiN4utKhC3DX,yHD3J9Xxvxban4YCS,2022-04-04T21:37:15Z,35,Male,English,true,,,,,,bachelor,yes,yes,agree,I think the pay was fair,The chat was easy to use,I didn't notice any problems or issues with the study,There was more than enough time on each round
baGZFCjoFje6J8aot,RMswBY8JCYxM5jd9z,yHD3J9Xxvxban4YCS,2022-04-04T21:37:15Z,34,male,english,true,,,,,,someCollege,yes,yes,stronglyAgree,Yes,Very easy,Nope,"Yeah, I think I had plenty of time"
rDjdtcccj5AJXh7ft,dvECmHKexGEkBpCch,yHD3J9Xxvxban4YCS,2022-04-04T21:37:26Z,32,Female,English,true,,,,,,someCollege,yes,yes,stronglyAgree,"Yes, I do.",Super easy!,No. Everything worked fine!,"Yes, I did."
odLD9ibLFy4yqEq4R,ka8QTnsPhky3G9vaw,yHD3J9Xxvxban4YCS,2022-04-04T21:37:41Z,21,Male,English,true,,,,,,someCollege,yes,yes,stronglyAgree,The pay seems fair considering how pleasant the study was.,The chat feature was seamless and I don't see any way to make it better.,No concerns. Flawless study and a pleasure to take part in!,We always had plenty of time and I never had an issue finding the right shape.
w4Nwtdcrg2fiicagk,34xLSnBRNFhypvHQB,7iF9MxsD2YYEcq3uq,2022-04-04T21:37:42Z,33,Male,English,true,,,,,,bachelor,yes,yes,stronglyAgree,Yes it was,It was easy.,No,Plenty of time
wzyjYmW5rN7AvoN7L,SpSp42ZaBDB3pmoEx,7iF9MxsD2YYEcq3uq,2022-04-04T21:37:53Z,24,Female,English,,,true,,,,bachelor,yes,yes,stronglyAgree,Yes good pay.,Yes and fun!,"No, thank you for the opportunity.",More than enough!
RjeupZBhHL7kxr92h,uZy2eXNCDzSfdNMY5,7iF9MxsD2YYEcq3uq,2022-04-04T21:37:55Z,31,female,English,true,,,true,,,someCollege,yes,yes,stronglyAgree,Yes,Very,Not at all. It was great working with everyone and we had a good rapport,Yes
wJEpYM4pij6ARHBLT,TTXnda8A2jgtmwufE,7iF9MxsD2YYEcq3uq,2022-04-04T21:38:00Z,24,Female,English,true,,,,,,bachelor,yes,yes,stronglyAgree,Yes as this was quite enjoyable,Yes very easy and fast typing,No no issues,Yes more than enough time
gEZN7zJBQfWRKTYGP,knxidzQ9B4Qf4xv94,7iF9MxsD2YYEcq3uq,2022-04-04T21:38:39Z,58,male,English,true,,,,true,,bachelor,yes,yes,stronglyAgree,"very much so, thank you",very east,none at all,more than enough time
rBw2MqhCS3QKJrfhM,v7mArTXRTqKrndoDF,7iF9MxsD2YYEcq3uq,2022-04-04T21:38:51Z,34,female,english,true,,,,,,bachelor,yes,yes,stronglyAgree,Yes I do.,Yes although it would have been good if it didn't reset each time.,No,Yes although it would have been good to be warned that once everyone made their selection it automatically finished. 
oqkoKBgWCiyS8vGkL,hJDSetAvyDD2KMgzj,3AkQAYjgybC5xKfov,2022-04-04T21:42:51Z,32,male,English,true,,,,,,bachelor,yes,yes,stronglyAgree,"Yes, thank you.",Yes,"Had no issues, everything went smoothly.",More than enough
jeRbLXvf5yCq2pmpe,x6LCLKcGHyqH7LAjn,3AkQAYjgybC5xKfov,2022-04-04T21:42:52Z,33,female,English,true,,,,,,someCollege,yes,yes,stronglyAgree,Yes,Yes,,Yes
dCRPG2Nr9f2nQXvKj,D4Qs3dPH4woAmLper,3AkQAYjgybC5xKfov,2022-04-04T21:43:03Z,26,Male,English,true,,,,,,bachelor,yes,yes,stronglyAgree,Very fair.,"It was very easy to use, and contributed greatly to our success.",No.,We had more than enough time.
n6eTBe2Qs8v96EPDm,bWKzgWeWGHFSJAP2s,3AkQAYjgybC5xKfov,2022-04-04T21:43:10Z,31,Female,English,true,,,,,,bachelor,yes,yes,stronglyAgree,Yes,Yes,No issues,More than enough
qojeGBxzcYMX8mRuX,NwCFNkGxhxB987HBz,3AkQAYjgybC5xKfov,2022-04-04T21:43:22Z,38,Male,English,true,,,,,,highSchool,yes,yes,stronglyAgree,Yes,Very easy to use,No issues or comments,More than enough
Wzty3Wz5Xawh4uJ9a,GcS94NqqyydhH2D2T,3AkQAYjgybC5xKfov,2022-04-04T21:43:32Z,31,male,English,true,,,,,,bachelor,yes,yes,stronglyAgree,The pay is fair.,The chat was easy to use.,There were no technical issues.,There was plenty of time each round.
LdMwpm58sJYeaNrMQ,t7qhGx4KeoNAa7Ro7,jqbckBkDqPTfmnAmt,2022-04-04T21:43:58Z,58,female,English,true,,,,,,highSchool,yes,yes,stronglyAgree,Yes,Yes,No,Yes
PxCntow8dNPbo8NMH,YWF8Br6zPBWgqJCG9,A4brqNjQNBqdGppGm,2022-04-04T21:44:10Z,42,Male,English,true,,,,,,bachelor,yes,yes,stronglyAgree,Yes,Yes,No,Yes
e8AwioC7em9nT8MPX,ivp27AKLo59PY7BGY,A4brqNjQNBqdGppGm,2022-04-04T21:44:20Z,32,female,english,true,,,,,,master,yes,yes,stronglyAgree,yes I think so,yes it was great,"no, it was enjoyable",yes more than enough
29FTs6mfEPAzAnFBR,v739tzAScRXTkdrLL,jqbckBkDqPTfmnAmt,2022-04-04T21:44:24Z,39,Female ,English,true,,,,,,highSchool,yes,yes,stronglyAgree,Yes,Yes,"No, best prolific survey I have ever done!!!!",More than enough
NKz2GZqcKRoruEkEP,CZjMnJYPjT9hJfLob,jqbckBkDqPTfmnAmt,2022-04-04T21:44:25Z,52,Male,English,true,,,,,,bachelor,yes,yes,stronglyAgree,Yes,Yes,No problems,Plenty of time - One of the players seemed slower than the rest
8R9ebnZv9ESw5MbXX,YJnnmhR57kqsvT7jm,A4brqNjQNBqdGppGm,2022-04-04T21:44:34Z,39,Male,English,true,,,,,,bachelor,yes,yes,stronglyAgree,"Yeah, the pay seemed fair for what I was doing.","It was very easy to use, yes.",n/a,We had plenty of time. We had almost too much time the last few rounds.
rdaMHbdq8yTgDbFNc,9usZ8Fu9uhcZPcYmD,A4brqNjQNBqdGppGm,2022-04-04T21:44:35Z,29,female,english,true,,,,,,bachelor,yes,yes,stronglyAgree,yes,"yes, very easy to use ","no, it was very enjoyable ",loads of time 
Z8ksokAk8C5pwyBDi,fCPet7jJtvBsJEcJt,A4brqNjQNBqdGppGm,2022-04-04T21:44:38Z,41,Male,English,true,,,,,,bachelor,yes,yes,stronglyAgree,"I guess, although the task took a lot longer than expected.",Yes,Nope,Yep
TqbwpkLyMYJkCEt8L,pMtHo7WxWotTEYE9e,jqbckBkDqPTfmnAmt,2022-04-04T21:44:43Z,32,male,english,true,,,,,,someCollege,yes,yes,stronglyAgree,"Yes, totally fair and thank you! :D",Very easy!,"I had to refresh it one time, I think after the 8 or 9/12 on this last go around but other than that it was all perfect, thank you for letting me participate, I'm in a better mood now because of the fun we had :)",More than enough time and it got so much quicker because we nailed down nicknames and nobody was being a grouch
8uLk7KnHTJp7jaeJ3,2HftqSZWWd5QL4eag,jqbckBkDqPTfmnAmt,2022-04-04T21:44:43Z,48,female,English,true,,,,,,bachelor,yes,yes,stronglyAgree,Yes it's great!,"yes for sure, had the best players!!",no,yes definitely
8NzNWeip38WEthtk4,YQA28oL4e96JjQLKx,jqbckBkDqPTfmnAmt,2022-04-04T21:44:47Z,35,female,english,true,,,,,,someCollege,yes,yes,stronglyAgree,yes,"yes, really fun","the instruction pages flashed while trying to read, but otherwise it's been highly enjoyable!",plenty 
WkfeqEt2C6tyGsS4s,dzpfBGMsX725DrGgS,A4brqNjQNBqdGppGm,2022-04-04T21:47:37Z,38,Female,English,true,,,,,,bachelor,yes,yes,stronglyAgree,"I think it was reasonable for the task given, a slightly better bonus would have been nice :)",Really straight forward to use,"Everything appeared to work well, I enjoyed the game :)","More than enough, especially in the latter rounds"
4RMoTyemb6XkPeokT,Jq22sb7BHehXXntkS,eak4aBM9swLfnmFWh,2022-04-04T21:48:22Z,51,Male,English,true,,,,,,someCollege,,no,agree,Yes.,Yes.,No.,Yes.
dcWiCeCcxMBJ5PDZb,Md6Gc6FXhQc7JLqqs,eak4aBM9swLfnmFWh,2022-04-04T21:48:46Z,39,female,english,true,,,,,,someCollege,yes,yes,stronglyAgree,Yes,"Yes, and it was also enjoyable.",While reading the instructions the page would randomly refresh.,"Yes, for sure."
QXqfPMtTt4oZH3Me2,dEkxadNo3o78mzYos,eak4aBM9swLfnmFWh,2022-04-04T21:48:52Z,31,nonbinary,English,true,,,,,,master,yes,yes,stronglyAgree,Yes,Yes easy to use,It was a lot of fun!,Yes plenty of time. Towards the end we got pretty fast because we made up names/descriptors for the different figures
7TqWmg26HDjYGrgNs,4rotLbtk2ZdLyQZAD,eak4aBM9swLfnmFWh,2022-04-04T21:49:22Z,28,Male,English,true,,,,,,someCollege,yes,yes,stronglyAgree,Yes,It was really easy.,"Everything was working really well, and the experience was awesome, it was great how easy we communicated in the game.",Yes
2esAD43HEFnNkHbvs,KeYz8BHzi6B46KLJu,eak4aBM9swLfnmFWh,2022-04-04T21:49:26Z,55,female,English,true,,,,,,master,yes,yes,stronglyAgree,"Yes, because the game was so fun.","Very easy to use. And fast response time, too.",I wondered if the study was secretly about the cute names/stereotypes groups come up with for human-like icons,"Yes, definitely- especially toward the end. "
GDokNEgLPbmXXykYf,tCXPwTazMiWoDPRxA,eak4aBM9swLfnmFWh,2022-04-04T21:51:45Z,50,male,english,true,,,,,,master,yes,yes,agree,I think so - it took me about an hour to get to this stage so the pay was fair and the time taken was as I expected,"Yes, it worked perfectly",The study worked well for me - it was fun and well designed!,"Yes, there was more than enough time. Round 1 took a while for each picture but there was enough time to describe/choose."
4SgdKvHb5cSjDBnYT,xHbcBCmnhjZonGDnw,2yTRgeWp8WH65rQQq,2022-04-04T21:54:10Z,46,female,english,true,,,,,,someCollege,yes,yes,stronglyAgree,yes,yes very easy.,no.,yes definitely enough time.
ZR439H9R5hxfcnfZ6,qYBRmoNdiWY9aFSwW,2yTRgeWp8WH65rQQq,2022-04-04T21:54:14Z,32,Male,English,,,true,,,,highSchool,yes,yes,stronglyAgree,No,Yes,Took longer than expected and stated,Yes
gMMSMhLJ8WxsF2neX,6orNN6e8XB9vh277r,2yTRgeWp8WH65rQQq,2022-04-04T21:54:30Z,33,female,english,true,,,,,,someCollege,yes,yes,stronglyAgree,"No it lasted a lot longer for the small amount of money, it was alot of work especially as the speaker",yes very easy,"nope, thanks",plenty of time once everyone got the hang of it 
6f3FFmtQMNkBH5e6p,fghzzJwxDiysENmzu,2yTRgeWp8WH65rQQq,2022-04-04T21:54:49Z,55,female,english,true,,true,,,,bachelor,yes,yes,agree,study was over long,yes,no,yes - after the first one or two
BNLTXrDR8nrmxyWDy,WaYui7sch79z2hjfN,2yTRgeWp8WH65rQQq,2022-04-04T21:56:14Z,26,Female,English,true,,,,,,bachelor,yes,yes,stronglyAgree,No. Task took longer than 70 minutes and reward should be minimum £10 for being an hour plus long. ,Yes very easy to use ,No,Yes
9hNH4A2peyqtQGxWH,ij5MEBTXzQKLmLSqb,2yTRgeWp8WH65rQQq,2022-04-04T21:58:38Z,30,M,English,,true,true,,,,highSchool,yes,yes,stronglyAgree,It was fair but the timer could have been shorter. Poor decision makers may drag out the entire exercise making the task not worth the time.,It works well and the generated colored icons are a nice touch. Thank you.,None.,More than enough.
